<?xml version="1.0" encoding="UTF-8"?>
<!--

    This work was created by participants in the DataONE project, and is
    jointly copyrighted by participating institutions in DataONE. For
    more information on DataONE, see our web site at http://dataone.org.

      Copyright ${year}

    Licensed under the Apache License, Version 2.0 (the "License");
    you may not use this file except in compliance with the License.
    You may obtain a copy of the License at

      http://www.apache.org/licenses/LICENSE-2.0

    Unless required by applicable law or agreed to in writing, software
    distributed under the License is distributed on an "AS IS" BASIS,
    WITHOUT WARRANTIES OR CONDITIONS OF ANY KIND, either express or implied.
    See the License for the specific language governing permissions and
    limitations under the License.

-->

<d1:systemMetadata xmlns:common="http://dataone.org/service/types/common/0.1"
 xmlns:d1="http://dataone.org/service/types/SystemMetadata/0.1"
 xmlns:xsi="http://www.w3.org/2001/XMLSchema-instance"
 xsi:schemaLocation="http://dataone.org/service/types/SystemMetadata/0.1 https://repository.dataone.org/software/cicore/tags/D1_SCHEMA_0_4/systemmetadata.xsd">
    <identifier>ABC123</identifier>
    <objectFormat>eml://ecoinformatics.org/eml-2.0.0</objectFormat>
    <size>922337203</size>
    <submitter>Robert P Waltz</submitter>
    <rightsHolder>DataONE</rightsHolder>
    <obsoletes>AFC123</obsoletes>
    <obsoletedBy>AFC12352</obsoletedBy>
    <derivedFrom>AFC</derivedFrom>
    <describes>AFC</describes>
    <describedBy>CFA</describedBy>
    <checksum algorithm="SHA-1">SGVsbG8gV29ybGQh</checksum>
    <embargoExpires>2006-05-04T18:13:51.0Z</embargoExpires>
    <accessRule rule="allow" service="read" principal="mn1 "/>
    <replicationPolicy replicationAllowed="true" numberReplicas="2147483647">
        <preferredMemberNode>mn1</preferredMemberNode>
        <blockedMemberNode>mn2</blockedMemberNode>
    </replicationPolicy>
    <dateUploaded>2006-05-04T18:13:51.0Z</dateUploaded>
    <dateSysMetadataModified>2006-05-04T18:13:51.0Z</dateSysMetadataModified>
    <originMemberNode>mn1</originMemberNode>
    <authoritativeMemberNode>mn1</authoritativeMemberNode>
    <replica>
        <replicaMemberNode>mn3</replicaMemberNode>
        <replicationStatus>queued</replicationStatus>
        <replicaVerified>2006-05-04T18:13:51.0Z</replicaVerified>
    </replica>
</d1:systemMetadata>
